Job Title,Company Name,Time,Applicants,Place,Job Description,Skill,Url
"b'Sr. Data Analyst, Financial Contract Reporting'",b'Warner Bros. Entertainment',"b""['Posted Date', 'Posted 2 weeks ago', '\\n            ', '\\n              ', '\\n              ', '\\n          ']""","b""['Number of applicants', '\\n                Be among the first 25 applicants\\n              ']""",b'',"b""'', '      ', '        ', '', '', 'What part will you play?', '', '', 'Warner Bros. Entertainment Inc. seeks a Senior Data Analyst, Financial Contract Reporting Administration for the FCRA Participations department. The Senior Data Analyst is responsible for analyzing large sets of financial and operational data in support of FCRA. The role focuses on using data to support management decision making efforts across ongoing operations and high-profile projects. The Data Analyst will utilize a broad range of tools and techniques to optimize reporting and to communicate results to technical and non-technical audiences alike. In addition, the Analyst must have the ability to communicate with all levels of management from peer analysts to vice presidents.', '', 'The Analyst should have experience with consulting or like organizations demonstrating the ability to enable process transformation through analytics. The candidate must have exemplary Excel skills and be able to fully leverage all features of the application including, but not limited to, large data set manipulation, complex formula creation and expert proficiency with the Visual Basic for Applications language that supports Excel. As the team builds out our exception-based reporting, working with Data visualization tools including Tableau (or similar tools) will enable the Analyst to help drive some of the more strategic projects within the organization.', '', '', '', ' Leverage the wealth of existing operational data to build models, user friendly applications and other reporting vehicles in order to aid management in the decision-making process. Utilize sophisticated user interface paradigms so the models can be easily constructed, revised and updated by management who are not familiar with statistical modeling tools. Developing accurate, dynamic and visual reports that clearly communicate the current state, probable trends and any significant anomalies that may help to explain variances from anticipated future business outcomes. ', ' Work with other departments within FCRA to clean existing data, to add new data to individual systems that would support more accurate and useful reporting. Work to improve the integration of the various data stores within FCRA to find previously unidentified correlations and trends. Look to build and refine user existing models to make them more user friendly. ', ' Document the models and methods used to transfer knowledge of the data itself and the reporting techniques used, on a periodic basis, to various individuals and groups within FCRA so that the department can increase its aptitude and comfort with analytical and data visualizing tools and methods. ', ' Work to identify and quantify the benefits delivered by implementing data analytics and visualization. Develop metrics and ongoing reporting to demonstrate the efficiencies achieved. ', '', '', 'What do we require from you?', '', '', ' Bachelor\xe2\x80\x99s Degree in Financial Engineering, Computer Science or equivalent. ', ' MBA or Project Management Certification is preferred. ', ' Minimum 3 years of work experience in data analysis, analytics and data visualization. Work experience in a large corporate environment is required. Entertainment industry experience is strongly preferred. ', ' Advanced knowledge of Excel is required including Visual Basic for Applications (minimum of 3 years experience using Excel as an advanced modeling tool). ', ' Experience working with Power BI and/or Tableau. ', ' Working knowledge of programming concepts and system implementations. Must have the ability to structure large quantities of data, resolve discrepancies and drive to deliver data driven answers. ', ' Understanding of relational databases. ', ' Working knowledge of SAP and data reporting tools such as Business Objects. ', ' Strong analytical, planning and organizational skills are required. ', ' Excellent written and verbal communication skills with the ability to craft compelling messages in visual formats describing data trends and issues. ', ' Needs to be a self-motivated individual. ', ' Ability to handle multiple tasks effectively. ', ' Must be a team player with good interpersonal skills.', '', '      ', '', '    '""",b'[]',b'https://www.linkedin.com/jobs/view/1122966455/?eBP=CwEAAAFpMrbpr73o6j0Sv7TzktJHKAuwL5w_vkRBRlRHV3SRaimuCMWKKxSIH-_Oog8xuMbZWIwTNmEZ1MOlyw4Sr8fQQr5BJNT9leeJajDOSzxcSBLSxnjz1mpVZy_NSxvMxk0q3bpQEC8p7Z4rDdX8J9LECH8kr_gQNzxHkWS-L2tU26hcb9oXTuGhWxycGSwlvglAtwMGvAS1ztMI34Aw6fXmT5xFHvDGzhrS9rAibsdOBdG860P5Kj8JVQ01UMsXUW08gIjIjcL5LSVgig8zma175LAe87TXGBPEPVcyDVBQn3usFavOCaEW0wgDfW2mTjpGgVJ6Fglxc8FQMaeL4lbx56Y&refId=c5a1567b-baab-467e-8d46-510a1f1ecc8c&trk=d_flagship3_search_srp_jobs'
b'Big Data Engineer (Microservices Developer)',b'Perficient',"b""['Posted Date', 'Posted 2 weeks ago', '\\n            ', '\\n              ', '\\n              ', '\\n          ']""","b""['Number of applicants', '\\n                Be among the first 25 applicants\\n              ']""","b'Los Angeles, CA, US'","b'\'\', \'      \', \'        At Perficient you\xe2\x80\x99ll deliver mission-critical technology and business solutions to Fortune 500 companies and some of the most recognized brands on the planet. And you\xe2\x80\x99ll do it with cutting-edge technologies, thanks to our close partnerships with the world\xe2\x80\x99s biggest vendors. Our network of offices across North America, as well as locations in India and China, will give you the opportunity to spread your wings, too.\', \'\', \'We\xe2\x80\x99re proud to be publicly recognized as a \xe2\x80\x9cTop Workplace\xe2\x80\x9d year after year. This is due, in no small part, to our entrepreneurial attitude and collaborative spirit that sets us apart and keeps our colleagues impassioned, driven, and fulfilled.\', \'\', \'Perficient currently has a career opportunity for a Big Data Engineer(Microservices Developer),\', \'\', \'\', \'Job Overview\', \'\', \'\', \'One of our large clients has made strategic decision to move all order management and sales data from their existing EDW into MapR platform. The focus is fast ingestion and streaming analytics. This is a multiyear roadmap with many components that will piece into a larger Data Management Platform. Perficient subject matter expert will work with the client team to move this data into new environment in a fashion that will meet requirements for applications and analytics. As a lead developer, you will be responsible for Microservices development.\', \'\', \'\', \'Responsibilities\', \'\', \'Ability to focus on framework for Dev Ops, Ingestion, and Reading/writing into HDFSWorked with different data formats (Parquet, Avro, JSON, XML, etc.)\', \' Worked on containerized solutions (Kubernetes..) \', \' Provide end to end vision and hands on experience with MapR Platform especially best practices around HIVE and HBASE \', \'Should be a Rockstar in HBase and Hive \xe2\x80\x9cBest Practices\xe2\x80\x9d\', \'Ability to focus on framework for Dev Ops, Ingestion, and Reading/writing into HDFS\', \'Worked with different data formats (Parquet, Avro, JSON, XML, etc.)\', \'Worked on containerized solutions (Spring Boot and Docker)\', \'Translate, load and present disparate data-sets in multiple formats and from multiple sources including JSON, Avro, text files, Kafka queues, and log data.\', \' Lead workshops with many teams to define data ingestion, validation, transformation, data engineering, and Data MOdeling \', \' Performance tune HIVE and HBASE jobs with a focus on ingestion \', \' Design and develop open source platform components using Spark, Sqoop, Java, Oozie, Kafka, Python, and other components \', \' Lead the technical planning & requirements gathering phases including estimate, develop, test, manage projects, architect and deliver complex projects \', \' Participate and lead in design sessions, demos and prototype sessions, testing and training workshops with business users and other IT associates \', \' Contribute to the thought capital through the creation of executive presentations, architecture documents and articulate them to executives through presentations \', \'\', \'\', \'Qualifications\', \'\', \'Spring, Docker, Hibernate\', \' /Spring \', \', JPA, Pivotal, Kafka, NoSQL,\', \'\', \'Hadoop Containers \xe2\x80\x93Docker, work, \', \' Spring boot \', \' . \', \' At least 3+ years of experience on working with large projects including the most recent project in the MapR platform \', \' At least 5+ years of Hands-on administration, configuration management, monitoring, performance tuning of Hadoop/Distributed platforms \', \' Should have experience designing service management, orchestration, monitoring and management requirements of cloud platform. \', \' Hands-on experience with Hadoop, Teradata (or other MPP RDBMS), MapReduce, Hive, Sqoop, Splunk, STORM, SPARK, Kafka and HBASE (At least 2 years) \', \' Experience with end-to-end solution architecture for data capabilities including: \', \' Experience with ELT/ETL development, patterns and tooling (Informatica, Talend) \', \' Ability to produce high quality work products under pressure and within deadlines with specific references \', \' VERY strong communication, solutioning, and client facing skills especially non-technical business users \', \' At least 5+ years of working with large multi-vendor environment with multiple teams and people as a part of the project \', \' At least 5+ years of working with a complex Big Data environment \', \' 5+ years of experience with Team Foundation Server/JIRA/GitHub and other code management toolsets \', \'\', \'\', \'Preferred Skills And Education\', \'\', \'\', \'Master\xe2\x80\x99s degree in Computer Science or related field\', \'\', \'Certification in Azure platform\', \'\', \'Perficient full-time employees receive complete and competitive benefits. We offer a collaborative work environment, competitive compensation, generous work/life opportunities and an outstanding benefits package that includes paid time off plus holidays. In addition, all colleagues are eligible for a number of rewards and recognition programs including billable bonus opportunities. Encouraging a healthy work/life balance and providing our colleagues great benefits are just part of what makes Perficient a great place to work.\', \'\', \'\', \'More About Perficient\', \'\', \'\', \'Perficient is the leading digital transformation consulting firm serving Global 2000 and enterprise customers throughout North America. With unparalleled information technology, management consulting and creative capabilities, Perficient and its Perficient Digital agency deliver vision, execution and value with outstanding digital experience, business optimization and industry solutions.\', \'\', ""Our work enables clients to improve productivity and competitiveness; grow and strengthen relationships with customers, suppliers and partners; and reduce costs. Perficient\'s professionals serve clients from a network of offices across North America and offshore locations in India and China. Traded on the Nasdaq Global Select Market, Perficient is a member of the Russell 2000 index and the S&P SmallCap 600 index."", \'\', \'Perficient is an equal opportunity employer and all qualified applicants will receive consideration for employment without regard to race, color, religion, sex, national, origin, disability status, protected veteran status, or any other characteristic protected by law.\', \'\', \'\', \' Disclaimer: \', \' The above statements are not intended to be a complete statement of job content, rather to act as a guide to the essential functions performed by the employee assigned to this classification. Management retains the discretion to add or change the duties of the position at any time.\', \'\', \'Select work authorization questions to ask when applicants apply\', \'\', \'\', \' Are you legally authorized to work in the United States?\', \' Will you now, or in the future, require sponsorship for employment visa status (e.g. H-1B visa status)?\', \'\', \'      \', \'\', \'    \''",b'[]',b'https://www.linkedin.com/jobs/view/1093295519/?eBP=CwEAAAFpMrbpsQZbZZiuaJ343BlVeqOkSWKz7gP-lK9VpxxrkoJcEwwDH_Kf11pCTcLL6nAqrnNSQB2PDRzJZNoaTJxiAavPazSQ-8_xVOV1nIaL22nFb8Tn5ysdlL6Hgv36Y6G_1naiiO9IuE3FLdvpNYoYvqKlJ2PFd80sjQHbjyT0eXX5buBbeio4B4mw9imeYxhz8J4Q176HuIuW8A0tgWaQIebkKj_mxHeXMXASnd6gGaDzyzpHoS2-uRbsVlbkgHn6KEIj36cCNHVHqffUfwb37A93mE4tRMFrIYgh3B103vmXvmqCFdN_gAIwnsSnolXbu7-xWxpFGcF7zT112EMGYEk&refId=c5a1567b-baab-467e-8d46-510a1f1ecc8c&trk=d_flagship3_search_srp_jobs'
b'Chief Data Scientist',b'Quotacom',"b""['Posted Date', 'Posted 3 weeks ago', '\\n            ', '\\n              ', '\\n                      ']""","b""['Number of applicants', '147 applicants']""","b'Los Angeles, California, United States'","b""'', '      ', '        ', 'Quotacom Ltd are currently working with the one of the industry\xe2\x80\x99s leading pioneering Big Data and Advanced Analytics services firm. They are a pure, technology agnostic Big Data Services business at the cutting edge of Big Data innovation. ', '\\xa0 ', 'The Chief Data Scientist will be managing a local team of expert Data Scientists as well as collaborating with some of the most talented Data Scientists and Engineers in the country.\\xa0 As Chief Data Scientist, you be applying your strong technical expertise and leadership skills to oversee, manage and work on top end advanced analytic projects with enterprise level organisations from a range of business sectors. ', '\\xa0 ', 'You will be working on site with some of the world\xe2\x80\x99s most exciting organizations.\\xa0Projects specialise on areas such as: Machine learning, Natural Language Processing (NLP) , Autonomous Driving, Fraud Detection and Artificial Intelligence. ', '\\xa0 ', 'Working with the latest open source software, tools and technologies you will be hands on as well as providing leadership and direction to your team ensuring the clients unique business requirements are met. ', '\\xa0 ', 'Candidate requirements:', ' ', 'Strong experience in building statistical models (with tools such as: R, Matlab, SAS) ', 'A proven ability to explore, manipulate and visualize data to discover new patterns ', 'Solid understanding of Advanced Analytics, Data Mining, Statistics, Mathematics, Natural Language Processing, Neural Networks, Machine Learning or Artificial Intelligence ', 'Managerial/leadership experience ', 'Fluent in English', ' ', '', ' ', 'If you feel you have the requisite skills, I would love to hear from you directly to discuss the opportunity in more detail.', '', '      ', '', '    '""","b""['Statistics', 'Matlab', 'Management', 'Machine Learning', 'Data Mining', 'Leadership', 'Natural Language Processing (NLP)', 'Analytics', 'Big Data', 'TensorFlow']""",b'https://www.linkedin.com/jobs/view/1104937158/?eBP=JOB_SEARCH_ORGANIC&refId=c5a1567b-baab-467e-8d46-510a1f1ecc8c&trk=d_flagship3_search_srp_jobs'
"b'Director, Data Science'",b'ZestFinance',"b""['Posted Date', 'Posted 2 weeks ago', '\\n            ', '\\n              ', '\\n              ', '\\n          ']""","b""['Number of applicants', '\\n                Be among the first 25 applicants\\n              ']""",b'',"b""'', '      ', '        ', 'The Director, Data Science will lead Zest\xe2\x80\x99s ML team to deliver technically excellent, highly predictive models to drive Zest\xe2\x80\x99s businesses. The Director, Data Science will also communicate and champion Zest\xe2\x80\x99s underwriting technologies to external constituencies including conferences, press, and potential clients. ', ' ', 'In this role you will:', ' ', 'Lead a team of 10+ data scientists in developing high-quality, robust predictive algorithms. ', 'Recruit, motivate, and develop the best data scientist talent in the world. ', 'Define Zest\xe2\x80\x99s modeling strategy and manage pipeline for internal and external modeling efforts. ', 'Translate unstructured business problems into well-defined machine learning projects. ', 'Help develop robust, scalable infrastructure for real-time predictions. ', 'Collaborate with a cross-functional team of Engineers, Product Managers, and Business Analysts to identify and manage high leverage opportunities for modeling work. ', 'Represent ZestFinance in calls, meetings, conferences to advance Zest\xe2\x80\x99s position as the world\xe2\x80\x99s leading ML team. ', 'Visibly drive innovation by incorporating new modeling capabilities and/or pioneering data sources. ', 'Develop and evangelize best practices for scoping, building, validating, and monitoring modeling projects. ', ' ', 'We are looking for:', ' ', 'Graduate Degree in Math, Computer Science, Statistics, or a related quantitative field. ', 'Prior experience in FinTech or related fields (preferred). ', 'Expert command of statistical analysis, algorithm development, and state-of-the-art tools and methodologies for data science. ', '8+ years creating predictive models using advance machine learning techniques. ', '3+ years managing a team of data scientists. ', 'Expert command of SQL and R or Python as applied to data science. ', 'Experience with Hadoop, Spark, or other big data platforms is a plus. ', 'Experience developing real-time production data pipelines. ', 'Experience interacting with external clients is a plus. ', ' ', 'Perks and benefits:', ' ', 'People \xe2\x80\x93 the best part of Zest ', 'Robust healthcare plans, matching 401K and unlimited vacation time ', 'Dog friendly office with lounge areas, video games and gigantic jigsaw puzzles ', 'On-site gym with yoga, salsa and other employee run fitness classes ', 'Generous family leave policy (6 month maternity leave/3 month paternity leave) ', 'Tuition reimbursement, conference allowance and Zest talks ', 'Complimentary massages, manicures, pedicures and more ', 'Daily catered lunches from LA\xe2\x80\x99s best restaurants and fully stocked kitchen', '', '      ', '', '    '""","b'[\'Statistics\', \'Python (Programming Language)\', \'Machine Learning\', \'Data Science\', \'R\', \'SQL\', \'Cross-functional Team Leadership\', \'Big Data\', \'Strategy\', \'Algorithms\', ""Master\'s Degree""]'",b'https://www.linkedin.com/jobs/view/1117815693/?eBP=JOB_SEARCH_ORGANIC&refId=c5a1567b-baab-467e-8d46-510a1f1ecc8c&trk=d_flagship3_search_srp_jobs'
b'Data Science Manager',b'Glocomms',"b""['Posted Date', 'Posted 14 hours ago', '\\n            ', '\\n', '          ', 'Over 200 applicants']""",b'',"b'Los Angeles, California, United States'","b""'', '      ', '        ', 'Overview', ' : Data Science Manager ', ' ', ' ', 'A cutting-edge, Bio-Tech firm is looking for a Data Science Manager to head up their rapidly growing engineering & Data Science team. This profitable, internationally recognized business is truly revolutionizing the potential of Biology research not just here in the United States but around the world. \\xa0Currently operating in over 20 countries, this position presents an opportunity to join a company and impact the global footprint of Human Therapeutics. \\xa0They have created a platform which provides live, real-time answers to complex questions. By utilizing the latest technologies, combined with unlimited access to data, statistics and expert research information, the platform is generating answers to improve health outcomes and answers for inquiries with multiple points of view: providing medicines that ', ' ', ' ', 'San Francisco Bay Area', ' ', ' ', '$150,000- $200,000 & equity & benefits', ' ', ' ', 'As a Data Scientist you would:', ' ', ' ', ' ', 'Support the development of the data science team on a global level ', ' ', 'Use quantitative and analytical acumen to advance analytical operations ', ' ', 'Responsible for providing thought leadership and driving and analytical support ', ' ', 'Apply Machine Learning, NLP, and over dynamic skills to the data platform ', ' ', 'Work closely across multiple business units ', ' ', 'Conduct key meeting with global stake holders ', ' ', ' ', 'Should have the following qualifications:', '\\xa0 ', ' ', ' ', 'Experience with statistical programming languages ', ' ', 'PhD preferred ', ' ', 'Previous work with Python, PySpark, and/or MATLAB ', ' ', 'Prior work with unstructured data ', ' ', 'Some working experience with AWS, Azure ', ' ', 'A desire to think strategically to drive business growth and recommend analytical approaches ', ' ', 'Excellent communication with the ability to bring logical & rational reasoning to any work completed ', ' ', 'Ability to manage and control multiple projects ', ' ', ' ', 'Perks:', ' ', ' ', ' ', 'Gym Membership ', ' ', 'Amazing office/campus ', ' ', 'Flexible on working hours ', ' ', 'Amazing All-Around Benefits Package!! ', ' ', 'Catered lunches and drinks on site ', ' ', 'Relocation provided!! ', ' ', ' ', 'For more info and a confidential chat please apply NOW or send me an email with resume included to Carlos.Martinez@Glocomms.com ! Our team is looking to speak to candidates ASAP!', '', '      ', '', '    '""","b""['Machine Learning', 'Legal Advice', 'Localization', 'Computer Vision', 'C++', 'Cross-functional Team Leadership', 'Start-ups', 'Automotive', '3D', 'Equities']""",b'https://www.linkedin.com/jobs/view/763356620/?eBP=JOB_SEARCH_ORGANIC&refId=c5a1567b-baab-467e-8d46-510a1f1ecc8c&trk=d_flagship3_search_srp_jobs'
b'Big Data Engineer',b'Ksquare Inc.',"b""['Posted Date', 'Posted 2 weeks ago', '\\n            ', '\\n              ', '\\n                      ']""","b""['Number of applicants', '54 applicants']""","b'Glendale, California'","b""'', '      ', '        ', 'Role : Big Data Engineer', ' ', 'Duration: Longterm', ' ', 'Location: Glendale , CA or Seattle, WA or Dallas, TX', ' ', 'Job Description : ', ' We need to build competency in Bigdata space for few immediate requirements\\xa0 . Following is the tech stack I am looking for for this effort. Can we start trying to find resources immediately. ', 'We need one Very Senior Engineer and\\xa0', '', 'Must: ', '', '1. Hadoop (HDP - Hortonworks Data Platform)', '2. Kafka', '3. Spark', '4. AWS', '5. Python ', '', 'Value Add:', '', '1. Informatica', '2. Teradata ', '3. Java ', ' ', ' ', 'Best Regards,', ' ', '\\xa0Vamshi Ennu', ' ', '\\xa0', 'Technical Recruiter, KSquare Solutions INC ', 'Phone :469-213-2602 ', 'Email :', '\\xa0Vamshi.ennu', '@ksquareinc.com |', '\\xa0', 'www.ksquareinc.com ', '909 Lake Carolyn Pkwy| Suite 301 |', '\\xa0', 'Irving, TX 75039', '', '      ', '', '    '""","b""['Python (Programming Language)', 'Engineers', 'Lake', 'Suite', 'Java', 'Teradata', 'Big Data', 'Stack', 'Email', 'Recruiting']""",b'https://www.linkedin.com/jobs/view/1124180176/?eBP=JOB_SEARCH_ORGANIC&refId=c5a1567b-baab-467e-8d46-510a1f1ecc8c&trk=d_flagship3_search_srp_jobs'
