Job Title,Company Name,Time,Applicants,Place,Job Description,Skill,Urlb'Data Scientist',b'Louisiana Economic Development',b'',b'',"b'Los Angeles, CA, US'","b'\'\', \'      \', ""        Waitr seeks a Data Scientist. You should Have 2+ years of industry experience developing machine learning models with business impact mdash more experience preferred Have a B.S., M.S., or PhD. in Statistics, Computer Science, Math, Physics, Economics, or other quantitative field Possess Deep understanding of statistics machine learning Be able to demonstrate the ability to write well written code (experience with Python preferred) Bonus points if you have experience with real-time technology problems have experience with Pandas Python machine learning libraries have experience with AWS SageMaker As a data scientist, you will have the opportunity to leverage our data infrastructure to develop models that impact millions of users across our three audiences and tackle our most challenging business problems. You will work with data scientists, engineers, and product managers to develop and iterate on models to help us grow our business. Here\'s how you\'ll be spending your week Use quantitative analysis and the presentation of data to see beyond the numbers and understand what drives our business Provide insights to help business and product leaders understand marketplace dynamics, user behaviors, and long-term trends Identify and quantify levers to help move key metrics Recommend which features to build and why Work backwards from understanding and sizing problems to ideating solutions Generate recommendations and use statistical techniques and hypothesis testing to validate your findings. This includes Performing analytical deep-dives to identify problems, opportunities and actions required Collecting, processing, and cleaning data from disparate sources using SQL, Python, or other scripting and statistical tools and Managing the design, execution, and analysis of experiments driving rigor and testing culture through product and operations teams Report against company initiatives by identifying key metrics and building executive-facing dashboards to track progress Monitor key performance metrics, understanding root causes of changes Build data sets and reporting tables to empower operational and exploratory analysis Partner with engineering to implement, document, validate, and iterate on building solutions at scale 8203We\'re looking for someone who Is high-energy and confident mdash yoursquoll do whatever it takes to win Is an owner mdash driven, focused, and quick to take ownership of your work Is humble mdash yoursquore willing to jump in and yoursquore open to feedback Is Adaptable, resilient, and able to thrive in ambiguity mdash things change quickly in our fast-paced startup and yoursquoll need to be able to keep up! Is Growth-minded mdash yoursquore eager to expand your skill set and excited to carve out your career path in a hyper-growth setting Has a strong desire for impact mdash ready to take on a lot of responsibility and work collaboratively with your team Is it worth it? Let us perk it. Ground floor opportunity with the team shape the strategic direction of the company. The rare opportunity to change the world such that everyone around you is using the product you built. Wersquore reinventing the dining experience. We support and encourage continual learning through sponsoring conference attendance and ongoing learning subscriptions. Sharp, motivated co-workers in a fun work environment. Full medicaldentalvision package to fit your needs. Nine paid company holidays. Unlimited vacation policy work hard and take time when you need it. Standard issue latest generation Macbook Pro (or an equivalent substitute of your choice.) Building a diverse and inclusive workplace where we learn from each other is an important part of the culture at Waitr. We welcome people of different backgrounds, experiences, abilities and perspectives. We are an equal opportunity employer and a fun place to work. Get ready to do the best work of your life here at Waitr! WAITR is an app based restaurant platform that connects restaurants and guests. Guests scroll restaurant menus, customize an order, modify any item, add people to a group order, split the check, choose delivery or carryout, and with the push of a button, have an order in their hands. WAITR has transformed the way restaurants reach people the way people choose restaurants. The WAITR delivery team on-demand delivery platform differentiates itself from the pack by being built by hospitality professionals for hospitality professionals. Over half a million orders have been handed to happy people by smiling WAITRs."", \'      \', \'\', \'    \''",b'[]',b'https://www.linkedin.com/jobs/view/1135098631/?eBP=NotAvailableFromVoyagerAPI&refId=c2ede163-9ca8-4041-86ec-b2aed8066d09&trk=d_flagship3_search_srp_jobs'
"b'Data Scientist, Customer Insights'",b'Los Angeles Times',"b""['Posted Date', 'Posted 3 weeks ago', '\\n            ', '\\n              ', '\\n              ', '\\n          ']""","b""['Number of applicants', '\\n                Be among the first 25 applicants\\n              ']""",b'',"b""'', '      ', '        You will be part of our data organization, where you\xe2\x80\x99ll have the chance to work with a team that includes data engineers, data scientists, analysts, and consumer researchers. Our goal is to help instill a data-first culture around our products, strategic initiatives, and business operations.', '', 'As a data scientist at the Los Angeles Times, you will have the chance to develop data models from our rich news content that is viewed and read by nearly 30 million people a month around the world. You\xe2\x80\x99ll also be looking at how we combine news data with other data sources available throughout the company to design innovative new data driven products that will help drive the business to a sustainable digital future.', '', 'To be successful in this role, we are looking for data scientists who enjoy exploring large data sets.', '', '', 'You need to be able to find insights from these data and then be able to create visualizations and dashboards that help make it explorable and understandable by other groups in the company.', 'Strong communications skills and an ability to clearly communicate insights derived by data will be needed.', '2+ years working with machine learning models, statistics, or applied mathematics.', 'Proficient in Python or R.', 'Strong understanding of modern machine learning techniques including regression, classification, clustering, and their use with text data.', 'Experience with NLP methods and how they are applied in machine learning contexts.', 'Excellent verbal and written communication skills. ', 'Skilled at using visualizations to tell stories with data.', 'Advanced degree in a quantitative field (Math, Statistics, Engineering, Economics, MBA, Predictive Analytics, or similar)', '', '      ', '', '    '""",b'[]',b'https://www.linkedin.com/jobs/view/1091992064/?eBP=NotAvailableFromVoyagerAPI&refId=c2ede163-9ca8-4041-86ec-b2aed8066d09&trk=d_flagship3_search_srp_jobs'
"b'Data Scientist - Machine Learning, Ad Tech'",b'Uber',"b""['Posted Date', 'Posted 3 weeks ago', '\\n            ', '\\n              ', '\\n              ', '\\n          ']""","b""['Number of applicants', '\\n                Be among the first 25 applicants\\n              ']""","b'Santa Monica, CA, US'","b""'', '      ', '        At Uber, we ignite opportunity by setting the world in motion. We take on big problems to help drivers, riders, delivery partners, and eaters get moving in more than 600 cities around the world.', '', 'We welcome people from all backgrounds who seek the opportunity to help build a future where everyone and everything can move independently. If you have the curiosity, passion, and collaborative spirit, work with us, and let\xe2\x80\x99s move the world forward, together.', '', 'We are looking for a Data Scientist to join our data science team to solve interesting and impactful business problems in the domain of marketing analytics and AdTech. The ideal candidate needs to have a strong curiosity for data, and demonstrable the ability to successfully apply rigorous scientific methods with proficiency in data science knowledge and technical capabilities. This is a unique opportunity to apply your skills and have a direct impact on global business.', '', 'What you will do', '', '', ' Build production grade models on large-scale datasets to optimize marketing performance by utilizing advanced statistical modeling, machine learning, or data mining techniques and marketing science research. ', ' Leverage models to address key growth challenges and provide actionable insights on problems such as cross-channel optimization, market/individual level response modeling, targeting optimization, LTV modeling, and etc. ', ' Work with cross-functional teams to implement and deploy models and enhance analytical solutions by providing data-driven recommendations. ', ' Leverage large scale data processing such as Spark, Hive, and Uber\xe2\x80\x99s proprietary machine learning platform, and more. ', ' Collaborate with marketing leadership, design, product and engineering teams. Participate in project planning/prioritization meetings, stakeholder meeting, data prioritization meeting, etc. ', '', 'What you will need', '', '', ' Minimum of 1-3 years of working experience as a data scientist ', ' Expertise with R and Python ', ' Experience with machine learning techniques and advanced analytics (e.g. regression, classification, clustering, time series, econometrics, causal inference, mathematical optimization). ', ' Advanced SQL skills - comfortable working with very large data sets. ', ' Experience with big data using technologies like Hadoop, Hive, and Spark a plus. ', ' Previous experience in advertising tech (e.g. market response modeling, forecasting, attribution, targeting, 3rd party data integration, and etc) is a plus ', ' Great communication skills, organized, able to multitask and be a team player ', ' Balance attention to detail with swift execution ', ' Hunger and drive to learn complex topics ', ' Enthusiasm about Uber!', '', '      ', '', '    '""",b'[]',b'https://www.linkedin.com/jobs/view/1140661469/?eBP=NotAvailableFromVoyagerAPI&refId=c2ede163-9ca8-4041-86ec-b2aed8066d09&trk=d_flagship3_search_srp_jobs'
b'Data Scientist',b'Cgi Technologies',"b""['Posted Date', 'Posted 4 weeks ago', '\\n            ', '\\n              ', '\\n              ', '\\n          ']""","b""['Number of applicants', '\\n                Be among the first 25 applicants\\n              ']""","b'Los Angeles, CA, US'","b'\'\', \'      \', \'        **Data Scientist**\', \'\', \'**Share this**\', \'\', \'Find similar career opportunities\', \'\', \'**Data Scientist**\', \'\', \'Category:** Development/Engineering\', \'City:** Los Angeles, California, United States\', \'Position ID:** J0119-1312\', \'Employment Type:** Full Time\', \'\', \'**Meet our professionals**\', \'\', \'**CGI: Committed to helping its professionals and clients**\', \'\', \'\', \'Position Description\', \'\', \'\', ""This position is responsible for business consulting activities for the Data Strategy and Analytics teams within our client organizations to monitor and assist in improving their analytics eco system. We need someone with a creative problem-solving skills to work on our client\'s business opportunities. Our Data Scientistwill work to understand high value opportunities and identify/build potential solutions, which often involve discovering new insights by transforming data into intuitive & interactive visualizations or applications"", \'\', \'\', \'Responsibilities\', \'\', \'\', \'Serve as an expert in translating complex data into key strategy insights and valuable actions.\', \'\', \'\xc3\xa2\xe2\x82\xac\xc2\xa2 Discover business narratives told by the data and present them to other scientists, business stakeholders, and managers at various levels.\', \'\', \'\xc3\xa2\xe2\x82\xac\xc2\xa2 Develop and test heuristics.\', \'\', \'\xc3\xa2\xe2\x82\xac\xc2\xa2 Create and run statistic/ML models.\', \'\', \'\xc3\xa2\xe2\x82\xac\xc2\xa2 Perform data exploration and data mining.\', \'\', \'\xc3\xa2\xe2\x82\xac\xc2\xa2 Create business intelligence, dashboards, visualizations, and/or other advanced analytics reports to adequately tell the business narrative and offer recommendations that are practiced, actionable, and have material impact, in addition to being well-supported by analytical models and data.\', \'\', \'\', \'Skills\', \'\', \'\', ""Work experience in addition to degree: 3 - 5 years of data engineering/science related activities with overall 10+ years\' experience."", \'\', \'\xc3\xa2\xe2\x82\xac\xc2\xa2 Graduation from a four-year college or university with a degree in statistics, physics, mathematics, engineering, computer science, or management of information systems.\', \'\', \'\xc3\xa2\xe2\x82\xac\xc2\xa2 Expert knowledge of SAS, Python Machine Learning or R\', \'\', \'\xc3\xa2\xe2\x82\xac\xc2\xa2 Working knowledge of statistics, programming and predictive modeling.\', \'\', \'\xc3\xa2\xe2\x82\xac\xc2\xa2 Working knowledge of code writing\', \'\', \'\xc3\xa2\xe2\x82\xac\xc2\xa2 Big Data/Hadoop/NoSQL and experience with large datasets\', \'\', \'\', \'Desired\', \'\', \'\', \'Doctorate in Computer science, Engineering, Physics or Statistics\', \'\', \'\', \'Skills\', \'\', \'Data Analysis\', \'SQL\', \'Python\', \'QlikView\', \'Data Architecture\', \'\', \'What You Can Expect From Us\', \'\', \'\', \'**Build your career with us.**\', \'\', ""It is an extraordinary time to be in business. As digital transformation continues to accelerate, CGI is at the center of this change-supporting our clients\' digital journeys and offering our professionals exciting career opportunities."", \'\', \'At CGI, our success comes from the talent and commitment of our professionals. As one team, we share the challenges and rewards that come from growing our company, which reinforces our culture of ownership. All of our professionals benefit from the value we collectively create.\', \'\', \'Be part of building one of the largest independent technology and business services firms in the world.\', \'\', \'Learn more about CGI at www.cgi.com .\', \'\', \'No unsolicited agency referrals please.\', \'\', \'CGI is an equal opportunity employer.\', \'\', \'Qualified applicants will receive consideration for employment without regard to their race, ethnicity, ancestry, color, sex, religion, creed, age, national origin, citizenship status, disability, medical condition, military and veteran status, marital status, sexual orientation or perceived sexual orientation, gender, gender identity, and gender expression, familial status, political affiliation, genetic information, or any other legally protected status or characteristics.\', \'\', \'CGI provides reasonable accommodations to qualified individuals with disabilities.\', \'\', \'If you need an accommodation to apply for a job in the U.S., please email the CGI U.S. Employment Compliance mailbox at US_Employment_Compliance@cgi.com . You will need to reference the requisition number of the position in which you are interested.\', \'\', \'Your message will be routed to the appropriate recruiter who will assist you. **Please note, this email address is only to be used for those individuals who need an accommodation to apply for a job.\', \'\', \'Emails for any other reason or those that do not include a requisition number will not be returned** .\', \'\', \'We make it easy to translate military experience and skills! Click here at https://cgi-veterans.jobs/ to be directed to our site that is dedicated to veterans and transitioning service members.\', \'\', \'All CGI offers of employment in the U.S. are contingent upon the ability to successfully complete a background investigation. Background investigation components can vary dependent upon specific assignment and/or level of US government security clearance held.\', \'\', ""CGI will not discharge or in any other manner discriminate against employees or applicants because they have inquired about, discussed, or disclosed their own pay or the pay of another employee or applicant. However, employees who have access to the compensation information of other employees or applicants as a part of their essential job functions cannot disclose the pay of other employees or applicants to individuals who do not otherwise have access to compensation information, unless the disclosure is (a) in response to a formal complaint or charge, (b) in furtherance of an investigation, proceeding, hearing, or action, including an investigation conducted by the employer, or (c) consistent with CGI\'s legal duty to furnish information."", \'      \', \'\', \'    \''",b'[]',b'https://www.linkedin.com/jobs/view/1141916108/?eBP=NotAvailableFromVoyagerAPI&refId=c2ede163-9ca8-4041-86ec-b2aed8066d09&trk=d_flagship3_search_srp_jobs'
b'Data Scientist',b'Columbus Technologies and Services',"b""['Posted Date', 'Posted 4 weeks ago', '\\n            ', '\\n              ', '\\n              ', '\\n          ']""","b""['Number of applicants', '\\n                Be among the first 25 applicants\\n              ']""","b'Pasadena, CA, US'","b""'', '      ', '        Ongoing contract position', '', 'W2 with full benefits', '', 'Customer and contract specific training will be required and provided.', '', '==', '', '', 'Job Description', '', '', 'Provide a Data Scientist Level II who will work in collaboration with data scientists in the Office of the Chief Information Office Chief Technology and Innovation Office\xe2\x80\x99s Innovation Experience Center (IEC) on innovative and strategic activities related to image recognition and deep learning for processing enterprise engineering data and digital documents. The candidate will work to develop machine learning models using Tensorflow to create structured record and data from unstructured and scanned digital sources. The candidate will create pipeline for large digital data and document extraction using latest technologies including Optical Character Recognition (OCR), and Recurrent Convolutional Neural Networks (RCNNs).The ideal candidate will have experience with Big Data, document processing with Apache Tika, and also experience building dynamic web services using Python and Flask is a plus. Some web development experience including Bootstrap, HTML, CSS, JavaScript is desired.The candidate should have broad experience in search and information retrieval.', '', '==', '', '', 'Required Skills', '', 'Must be a US Citizen or Green Card Holder', 'Offer contingent on ability to successfully pass a background check and drug screen', '', '', '      ', '', '    '""",b'[]',b'https://www.linkedin.com/jobs/view/1093990550/?eBP=NotAvailableFromVoyagerAPI&refId=c2ede163-9ca8-4041-86ec-b2aed8066d09&trk=d_flagship3_search_srp_jobs'
b'Data Scientist - Marketplace',b'NEXT Trucking',b'',b'',"b'Los Angeles, CA, US'","b""'', '      ', '        At NEXT Trucking, we provide painless freight to shippers that fit the lifestyles of our carriers. Central to providing this service is our marketplace, where carriers find shipment opportunities that fit their price, location, equipment, and schedule. It is important for our business that shipment opportunities and carriers are able to efficiently match on our marketplace. We have a rich dataset of previous freight loads that were matched on the marketplace that can suggest product improvements and power data products.', '', 'We are looking for a data scientist to join our team and use our datasets to improve the NEXT marketplace. You will collaborate with peers on an interdisciplinary team as the voice of data. Your projects will range from crafting measurements of marketplace health to suggesting design improvements and building data products.', '', '', 'Responsibilities', '', '', 'Define key metrics and understand the levers of these metrics', '', 'Find opportunities in our marketplace to improve efficiency, and convey them in a compelling narrative', '', 'Establish a culture of data on your team', '', 'Patch instrumentation gaps by driving logging efforts', '', 'Build maintainable data pipelines to produce consumable datasets', '', 'Build tooling, such as python/R functions, tests and alerts on pipelines, and report automation', '', 'Bootstrap machine learning models and measure their value via experimentation', '', '', 'Qualifications', '', '', 'Comfortable with coding, ideally in a mix of Python, R, and SQL', '', 'Comfortable learning new data tools and frameworks', '', 'Ability to communicate analysis to diverse audiences', '', 'Basic understanding of statistical concepts such as hypothesis testing, power tests, and when differences are meaningful', '', 'Can make intuitive data visualizations that drive product impact', '', 'Ability to formulate and validate data products, including framing the problem, crafting the dataset, and evaluating the model', '', '', 'Next Trucking Benefits', '', '', 'Competitive Base Salary and Equity', '', 'Full Medical, Dental and Vision Benefits', '', '401K w/ company match', '', 'Vacation and Holidays.', '', '', 'NEXT', ' is a venture-backed company boldly taking on the challenge of digitizing the $900B freight trucking industry. Our technology is transforming the way shippers and truckers engage and communicate by creating an on-demand platform where shippers can instantly find truckers with capacity and be able to have real time tracking updates and transparency with the movement of their freight throughout the entire shipping process.', '', '', 'NEXT', ' was founded by Lidia Yan and Elton Chung with over 20 + years of experience in logistics and technology. We have raised over $125M led by Sequoia Capital and Brookfield Venture Capital.', '', 'We have assembled a team with experience from companies such as Google, C.H. Robinson, Apple, Idealab, Kareo and GoFundMe.', '      ', '', '    '""",b'[]',b'https://www.linkedin.com/jobs/view/1122723556/?eBP=NotAvailableFromVoyagerAPI&refId=c2ede163-9ca8-4041-86ec-b2aed8066d09&trk=d_flagship3_search_srp_jobs'
