Job Title,Company Name,Time,Applicants,Place,Job Description,Skill,Urlb'Senior Data Analyst - Video Games',b'PerBlue',"b""['Posted Date', 'Posted 4 weeks ago', '\\n            ', '\\n              ', '\\n                      ']""","b""['Number of applicants', '196 applicants']""",b'Greater Los Angeles Area',"b'\'\', \'      \', \'        \', \'This is a challenging, incredibly fun role that will \', \'require a paid relocation to our Madison, Wisconsin headquarters\', "", where you\'ll find an incredible cost of living, quality of life, and freedom of play.\\xa0 "", \' \', ""Please note that we\'re unable to provide visa sponsorship at this time.\\xa0 "", \' \', ""If you\'re cool with all this, read on! "", \' \', \'PerBlue is looking for a talented \', \'Senior Data Analyst\', \'\\xa0to join our team. We\xe2\x80\x99re a quickly growing independent studio whose free-to-play midcore mobile games have been played by millions people around the world, including our recently launched \', \'Disney Heroes: Battle Mode\', \'\\xa0game. We\xe2\x80\x99re looking for an ambitious data lover who can help us dig through mountains of video game data, analyze it, find actionable insights, and present them to everyone else in the team. \', \'\\xa0 \', \'Responsibilities\', \' \', \'This highly cross-functional role interacts regularly with marketing, live-ops, development, product, and management teams. You\xe2\x80\x99ll be a key addition to our BI team and be involved in the full lifecycle of our data infrastructure - everything from designing database schemas and writing SQL queries, to creating and presenting succinct and informative dashboards and visualizations. \', \' \', \'Our ideal candidate is a quick learner who is very detail-oriented, goal driven, and truly loves analyzing numbers and making sense of large amounts of data. You should have a strong motivation to work with data and technology in a fast-paced, dynamic environment. \', \'\', \'Requirements and Qualifications\', \' \', ""Bachelor\'s degree or higher in Statistics, Mathematics, Information Systems, Computer Science, or related field "", \'Minimum 2 years experience in data-related role \', \'Minimum 2 years experience writing analytic SQL queries (emphasis on SELECTs using JOINs, not so much INSERTs/UPDATEs) \', \'Ability to effectively communicate with a variety of stakeholders \', \'Self motivated and resourceful with the ability to work autonomously \', \'Close attention to detail, process driven, and results-focused \', \'Proactive and able to take ownership of tasks and projects \', \'Strong desire to learn new things \', \'\\xa0 \', \'Preferred Skills and Experience\', \' \', \'Experience with Postgres and/or Snowflake/Redshift cloud database querying \', \'Experience with Tableau or other popular data exploration, visualization and dashboarding software \', \'Experience with machine learning \', \'Experience with artificial intelligence \', \'Experience data modeling \', \'Experience doing basic statistical analyses (AB testing, confidence intervals, etc) \', \'Experience with mobile and/or online games industry a big plus \', \'Regression experience a plus \', \'Machine learning and other prediction/classification methods a plus \', \'Object oriented programming, specifically Python a plus \', \'\\xa0 \', \'\\xa0 \', \'Key Duties Will Include\', \' \', \'Develop a strong understanding of our games, game design principles, core metrics and underlying assumptions, so they can be effectively questioned, tested, and proven/disproven. \', \'Break down requests for data/analysis into smaller, actionable plans to guarantee the end user will get their real questions answered. \', \'Improve existing Tableau dashboards and create new ones with a keen eye toward end user experience (ease of understanding, clarity, dashboard responsiveness, consistency, etc) \', \'Writing SQL for data exploration, quick question-answer, and for more in-depth analysis via Tableau Data Sources, statistical software, etc. \', \'Do more thorough analyses when needed, including coming up with your own hypotheses, testing, revising, and ultimately providing data-driven, evidenced recommendations. \', \'Effectively provide key summaries of actionable takeaways while also providing deeper evidence and analysis for end users wanting deeper insight. \', \'\\xa0 \', \'Compensation and Benefits\', \' \', ""We offer 6+ weeks of paid vacation and health, dental, and vision insurance as well as a well-matched 401k. We have a catered lunch program, a snack-stocked kitchen, and a refrigerator full of liquid refreshments. You\'ll get membership to our local hackerspace Sector67 and enjoy our regular socials. You\'ll be part of an energetic and collaborative environment, and work with a great team. We have flexible hours and are located in a vibrant neighborhood in beautiful downtown Madison. "", \' \', ""PerBlue is an independent game development studio based in Madison, WI with a highly skilled team of amazingly talented people. We\xe2\x80\x99ve been named a \xe2\x80\x9cTop Developer\xe2\x80\x9d by Google, a \xe2\x80\x9cBest Place to Work\xe2\x80\x9d by Madison Magazine, and \xe2\x80\x9cMadison\'s Favorite Tech Startup\xe2\x80\x9d by the Isthmus. "", \'This is a full time position based in Madison, WI. Compensation is competitive and based on experience.\', \'\', \'      \', \'\', \'    \''","b'[\'Statistics\', \'Python (Programming Language)\', \'Data Analysis\', \'Mobile Games\', \'SQL\', \'Tableau\', \'Statistical Data Analysis\', \'Google Analytics\', \'Video Games\', \'Data Modeling\', ""Bachelor\'s Degree""]'",b'https://www.linkedin.com/jobs/view/1099441667/?eBP=JOB_SEARCH_ORGANIC&refId=ce9a2ab6-e944-4b2e-8d13-1ce595073194&trk=d_flagship3_search_srp_jobs'
b'Product Data Scientist - Engineering',b'Snap Inc.',"b""['Posted Date', 'Posted 4 weeks ago', '\\n            ', '\\n              ', '\\n                      ']""","b""['Number of applicants', '133 applicants']""","b'Los Angeles, CA, US'","b""'', '      ', '        We\xe2\x80\x99re looking for a Data Scientist to join Snap Inc! Working closely alongside the engineering, product design and product management teams, you will enjoy creating inventive, data-based approaches to solving difficult business problems. Working from our Los Angeles, Mountain View, or San Francisco, CA offices, you\xe2\x80\x99ll work to transform business questions into data analysis.', '', '', 'What You\xe2\x80\x99ll Do', '', ' Partner with Product and Engineering and apply your expertise in quantitative analysis to create and scale insights ', ' Create testable hypotheses, then test them ', ' Effectively report your insights via visualization and dashboards that you create ', ' Help business and engineering partners make decisions based on data ', '', '', 'Minimum Qualifications', '', ' BA in math, statistics, computer science, or other quantitative field ', ' 3+ years of experience in quantitative analysis & data science or a related field ', ' Fluency in SQL or other big data querying language ', '', '', 'Preferred Qualifications', '', ' Strong statistical knowledge ', ' MA degree in math, statistics, computer science, or other quantitative field ', ' Experience in a product-focused role at a social media and/or mobile technology company ', ' Experience with analytical packages such as SciPy or R ', ' Experience with data pipeline workflow monitoring and scheduling platforms (e.g., Airflow) ', ' Experience with a programming language, such as Python ', ' Ability to initiate and drive projects to completion with minimal guidance ', ' Ability to communicate the results of analyses in a clear and effective manner to a senior audience ', ' Machine learning skills', '', '      ', '', '    '""",b'[]',b'https://www.linkedin.com/jobs/view/1095771919/?eBP=JOB_SEARCH_ORGANIC&refId=ce9a2ab6-e944-4b2e-8d13-1ce595073194&trk=d_flagship3_search_srp_jobs'
"b'Data Science Associate (Los Angeles, CA)'",b'ZS',"b""['Posted Date', 'Posted 4 weeks ago', '\\n            ', '\\n              ', '\\n                      ']""","b""['Number of applicants', '200 applicants']""","b'Los Angeles, CA, US'","b'\'\', \'      \', \'        \', \'ZS\', \' is the world\xe2\x80\x99s largest consulting firm focused exclusively on improving business performance through sales and marketing consulting solutions, from customer insights and strategy to analytics, operations and technology. Together, we design and implement strategies that lead to greater market share, more competitive operations and increased use of today\xe2\x80\x99s latest technologies. From our worldwide offices, ZS professionals draw on deep industry and domain expertise to deliver impact where it matters for clients. We are particularly known for our expertise in the pharmaceutical and health care sectors, yet work across a range of industries.\', \'\', \'\', ""ZS\' Business Consulting group"", \' delivers solutions to a broad spectrum of sales and marketing challenges. We also help our clients transform their sales and marketing strategies and organizations to improve their effectiveness. Our recommendations and solutions are based in rigorous research and analysis underpinned by deep expertise and thought leadership across the demand generation process.\', \'\', \'\', \'DATA SCIENCE ASSOCIATE \', \'\', \'\', \'DSAs Will Deliver Client Impact Through\', \'\', \'\', \'Data Science Associates (DSAs) design, develop and execute algorithmic, statistical and/or machine learning techniques on large, complex, structured and unstructured data sets (including big data) to help clients make better fact-based decisions.\', \'\', \'Collaborate with team leadership on research and development of new algorithms\', \'Customization of general-purpose algorithms to specific context-rich client situations\', \'Contribution to development of the ZS point of view in AI/ML/data science space\', \'\', \'\', \'Responsibilities\', \'\', \'Investigate and develop rigorous analytical frameworks to address client problems\', \'Effectively work with a variety of different data \xe2\x80\x93 structured vs. unstructured, sparse vs. big data \xe2\x80\x93 to perform modeling and analysis\', \'Develop advanced algorithms that solve problems of large dimensionality in a computationally efficient and statistically effective manner\', \'Execute statistical and machine learning techniques (e.g. supervised learning, unsupervised learning, reinforcement learning) on data sets to identify trends, figures and other relevant information\', \'Collaborate with clients and other ZS stakeholders to effectively integrate and communicate analysis findings\', \'Evaluate emerging datasets and technologies that may contribute to our analytical offerings\', \'\', \'\', \'Qualifications\', \'\', \'Master\xe2\x80\x99s Degree in Data Science, Computer Science or Statistics with strong academic performance in analytic and quantitative coursework required\', \'Knowledge of advanced analytics concepts and algorithms (e.g. machine learning, statistical learning, Bayesian methods, neural networks, optimization, natural language processing, etc.)\', \'Demonstrates proficiency in programming languages such as R/Python\', \'Exposure to tools/platforms (e.g. Hadoop eco system and database systems)\', \'Agile project planning and project management skills\', \'Excellent oral and written communication skills\', \'Strong attention to detail, with a research-focused mindset\', \'Excellent critical thinking and problem-solving skills\', \'Aptitude for, and enjoyment of working in teams\', \'High motivation, good work ethic and maturity\', \'\', \'\', \'ZS is a global consulting firm; fluency in English is required, additional fluency in at least one European or Asian language is desirable.\', \'\', \'Candidates must possess work authorization for their intended country of employment. An on-line application, including a cover letter expressing interest and a full set of transcripts (official or unofficial), is required to be considered.\', \'\', \'ZS offers a competitive compensation package with salary and bonus incentives, complete medical/dental/life insurance programs and retirement savings benefits. We are an Equal Opportunity Employer.\', \'\', \'\', \'NO AGENCY CALLS, PLEASE.\', \'\', \'      \', \'\', \'    \''",b'[]',b'https://www.linkedin.com/jobs/view/1048563673/?eBP=JOB_SEARCH_ORGANIC&refId=ce9a2ab6-e944-4b2e-8d13-1ce595073194&trk=d_flagship3_search_srp_jobs'
b'Senior Big Data Engineer',b'Talener',"b""['Posted Date', 'Posted 2 weeks ago', '\\n            ', '\\n              ', '\\n                      ']""","b""['Number of applicants', '40 applicants']""","b'Los Angeles, CA, US'","b""'', '      ', '        ', 'The Client', '', '', 'Located in Santa Monica, our client is a marketing company that provides online competitive intelligence service. They have been providing up-to-date analysis of online trends to clients for over 20 years. They serve clients in the financial service, media, travel, and retail sectors.', '', '', 'The Job', '', '', 'Our client is looking for a Senior Big Data Engineer who is interested in working with large-scale, multi-tiered applications. The ideal candidate will have experience building and scaling big data systems. Likewise, this person will have experience with full software development lifecycle. A minimum of 5 years development with Java or Scala is required.', '', '', 'Required Skills', '', '5+ yrs of development experience (Java/Scala)', '2+ yrs of experience working hands-on with Big Data technologies', 'Written & supported products with Big Data(Hadoop, Cassandra. Spark)', 'Experience working on highly scalable systems', 'Test-driven development', 'Experience with NoSQL, Redshift, Hbase, Redis, Spark, or Impala', '', '', 'Additional Skills', '', 'Spring, Hibernate', 'Jupiter, Zeplin', 'Building web services', '', 'The Offer', '', 'Competitive salary, based on experience', 'Medical, dental, and life insurance', 'Flexible time off and working hours', 'Free, catered lunch every day', 'Gym and green commuter benefits', '401k matching', 'Collaborative culture and great work/life balance', '', 'Email Brian at bsamela@talener.com for more information or to apply.', '', 'Local candidates only. Only candidates authorized to work for any employer in the United States will be considered. Our client is unable to provide sponsorship at this time.', '      ', '', '    '""",b'[]',b'https://www.linkedin.com/jobs/view/1070347088/?eBP=JOB_SEARCH_ORGANIC&refId=ce9a2ab6-e944-4b2e-8d13-1ce595073194&trk=d_flagship3_search_srp_jobs'
b'Data Scientist',b'OpenX',"b""['Posted Date', 'Posted 3 weeks ago', '\\n            ', '\\n', '          ', 'Over 200 applicants']""",b'',b'',"b""'', '      ', '        OpenX seeks a Data Scientist to be responsible for executing critical R&D projects on a petabyte-scale dataset. Working in a highly collaborative environment, you will assist with design, prototyping, development, and deployment of data-driven products and features. The ideal candidate will create algorithms and models to optimize a wide variety of metrics to improve OpenX\xe2\x80\x99s functionality and performance within the ad tech market.', '', '', 'Key Responsibilities', '', ' ', 'Pull data from big data framework for analyses and model training', ' ', 'Rapidly prototype models, including creation, training, and evaluation', ' ', 'Implement production training and real-time model evaluation architectures (in an existing code base)', ' ', 'Run experiments to assess model performance', ' ', '', '', 'Required Qualifications', '', ' ', 'Data Scientist: Ph.D in Computer Science, Statistics, Physics, Mathematics, Operations Research or related field, or MS with 3+ years of experience', ' ', 'Ability to develop machine learning algorithms and models offline and deploy them to a real-time production environment', ' ', 'Solid background in machine learning/data science, control theory, signal processing, or image processing', ' ', 'Experience with machine learning languages and tools such as python/pandas, R, tensorflow/pytorch', ' ', 'Familiarity with big data technologies such as SQL, Hadoop, Hive, Impala, Scala, Spark, etc', ' ', 'Experience with Java highly preferred', ' ', '', 'Desired Characteristics', '', ' ', 'Experience with machine learning on GCP, AWS or Azure', ' ', 'Ability to collaborate with teams of people across analytics, engineering, business, and product', ' ', 'Proven track record of designing, executing, and analyzing complex experiments', ' ', 'Ability to accurately summarize and report findings to a broad audience', ' ', 'Excellent written and verbal communication skills', ' ', '', '', 'Company At a Glance', '', '', 'OpenX is focused on unleashing the full economic potential of digital media companies. We do this by making digital advertising markets and technologies that are designed to deliver optimal value to publishers and advertisers on every ad served across all screens.', '', 'At OpenX, we have built a team that is uniquely experienced in designing and operating high-scale ad marketplaces, and we are constantly on the lookout for thoughtful, creative executors who are as fascinated as we are about finding new ways to apply a blend of market design, technical innovation, operational excellence, and empathetic partner service to the frontiers of digital advertising.', '', '', 'OpenX Values', '', '', 'Our five company values form a solid bedrock serving to define us as a group and guide the company. Our values remind us that how we do things often matters as much as what we do.', '', '', 'We are one', '', '', 'One team. No exceptions. We are a group of strong and diverse individuals unified by a clear common purpose.', '', '', 'Our customers define us', '', '', 'We know our business flourishes or dies because of our customers.', '', '', 'OpenX is mine', '', '', 'We are all owners of OpenX. We stake our personal and professional reputations on the excellence of our work.', '', '', 'We are an open book', '', '', 'We are eager to teach and share what we know with others.', '', '', 'We evolve fast', '', '', 'We take risks and confront failure openly. We recognize and repeat success aggressively. We actively seek out and provide constructive criticism. Defensiveness is for weaklings!', '      ', '', '    '""",b'[]',b'https://www.linkedin.com/jobs/view/1015151240/?eBP=JOB_SEARCH_ORGANIC&refId=ce9a2ab6-e944-4b2e-8d13-1ce595073194&trk=d_flagship3_search_srp_jobs'
b'Lead Data Engineer',b'HIRECLOUT',"b""['Posted Date', 'Posted 3 weeks ago', '\\n            ', '\\n              ', '\\n                      ']""","b""['Number of applicants', '94 applicants']""","b'Los Angeles, CA, US'","b""'', '      ', '        ', 'Job Description', '', '', 'Lead Data Engineer', '', 'Are you looking for a revolutionary career where you can make an impact? Does the prospect of changing the way people view the live entertainment industry excite you? Then join our team today! We\xe2\x80\x99re a team of bright, driven, and experienced developers, product designers, and entertainment lovers looking for a pro-active and well-rounded, Lead Data Engineer to help us manage our data warehouse infrastructure.', '', '', 'What You\xe2\x80\x99ll Do', '', ' ', ' Develop and main tain data pipeline architecture ', ' ', ' Put together large, complex data sets that will meet our business requirements ', ' ', ' Architect, develop, and deploy internal process improvements including automating manual processes, optimizing data delivery, and scaling our infrastructure ', ' ', ' Create the optimal infrastructure for data extraction, transformation, and loading from a variety of data sources using SQL and AWS. ', ' ', ' Create analytics tools to utilize data pipeline to provide valuable insights into major key performance metrics ', ' ', ' Work along side stakeholders including Executive, Product, and Data teams to solve technical issues and support data infrastructure requirements ', ' ', ' Organize data into secure boundaries through multiple data centers and AWS regions. ', ' ', ' Develop tools for analytics and data scientist team members that assist them in building and optimizing our core product into an industry leader ', ' ', ' Work with data and analytics experts to strive for greater fu nctionality in our data systems ', ' ', ' Collaborate with data and analytics teams to increase functionality in our data systems ', ' ', '', '', 'You Have', '', ' ', ' SQL expertise and experience working with relational databases, writing complex queries, as well as exposure to a variety of databases. ', ' ', ' Experience creating and optimizing data ETL pipelines, architectures, and data sets ', ' ', ' Experience performing root cause analysis on both internal and external data, and the ability to identify areas for improvement while answering specific business needs. ', ' ', ' Strong experience working with unstructured datasets ', ' ', ' Build processes supporting data transformation, data structures, metadata, dependency and workload management. ', ' ', ' Ability to manipulate, process, and extract value form various disconnected data sources. ', ' ', ' Knowledge of message queuing, stream processing, and highly scalable data stores. ', ' ', ' Ability to support and collaborate with cross-functional teams in an Agile environment. ', ' ', ' 5 + years of experience in a Data Engineer role, and a BS degree in Computer Science, Statistics, Informatics, Information Systems or another quantitative field. ', ' ', ' Experience with big data tools such as Hadoop, Spark, Kafka, etc. ', ' ', ' Experience with relational SQL and NoSQL databases, including Postgres and Cassandra. ', ' ', ' Experience with data pipeline and workflow management tools: Azkaban, Luigi, Airflow, etc. ', ' ', ' Expe rience with AWS cloud services such as EC2, EMR, RDS, Redshift ', ' ', ' Experience with stream-processing systems such as Storm, Spark-Streaming, etc. ', ' ', ' Experience with object-oriented/objec t function scripting languages such as Python, Java, C++, Scala, etc.', '', '      ', '', '    '""",b'[]',b'https://www.linkedin.com/jobs/view/905131594/?eBP=JOB_SEARCH_ORGANIC&refId=ce9a2ab6-e944-4b2e-8d13-1ce595073194&trk=d_flagship3_search_srp_jobs'
b'Data Scientist - Games',"b'NBCUniversal Media, LLC'","b""['Posted Date', 'Posted 2 weeks ago', '\\n            ', '\\n              ', '\\n                      ']""","b""['Number of applicants', '52 applicants']""","b'Universal City, CA, US'","b""'', '      ', '        ', 'Responsibilities', '', '', 'Essential Responsibilities', '', 'Ideation of data models and modeling (i.e. historical as well as predictive models)', 'Working with the Games team and partners to understand what are the needed KPIs in addition to what selected BI tools provide', 'Help design and monitor A/B tests', 'Ideate cross-promotion campaigns', 'Work across teams to identify needs and translate them to modeling mandates', 'Explain player behavior and campaign results ', '', '', 'Basic Qualifications', '', '', 'Qualifications/Requirements', '', '', '2+ years of experience performing statistical and predictive analytics within video games industry', 'Expert in machine learning', 'Expertise in R and Python', 'Must have more than a passing familiarity with Behavioral Science or Psychology or Social Science', '', '', 'Eligibility Requirements', '', '', 'Interested candidates must submit a resume/CV online to be considered', 'Must have unrestricted work authorization to work in the United States', 'Must be covered by Solutions, NBCU\xe2\x80\x99s Alternative Dispute Resolution Program', '', 'Desired Characteristics', '', '', 'Desired Characteristics', '', '', 'Expertise in Java and C/C++ a plus', 'Understanding of Big Data technologies (Cassandra, Spark, Hadoop) strongly preferred', '', 'Sub-Business', '', 'Film Brand Development', '', 'Career Level', '', 'Experienced', '', 'City', '', 'Universal City', '', 'State/Province', '', 'California', '', 'Country', '', 'United States', '', '', 'About Us', '', '', 'Are you a fan of The Fast and the Furious, Jurassic World, or Back to the Future? Have you ever dreamed about working on innovative games based on your favorite movies and TV shows? If so, The Universal Games and Digital Platforms group is looking for you! Join a diverse group of creative talent, crafting groundbreaking interactive experiences inspired by some of the world\xe2\x80\x99s most valuable brands. Operating with a start-up mindset, the business unit is nimble, and explores new and emerging platforms, such as AR and VR, to stay at the forefront of innovation.They\xe2\x80\x99re currently looking for even more movers and shakers, because this group is GROWING. Could you be the next member of the team that really is all \xe2\x80\x98fun and games\xe2\x80\x99?', '', '', '', 'Notices', '', 'NBCUniversal\xe2\x80\x99s policy is to provide equal employment opportunities to all applicants and employees without regard to race, color, religion, creed, gender, gender identity or expression, age, national origin or ancestry, citizenship, disability, sexual orientation, marital status, pregnancy, veteran status, membership in the uniformed services, genetic information, or any other basis protected by applicable law. NBCUniversal will consider for employment qualified applicants with criminal histories in a manner consistent with relevant legal requirements, including the City of Los Angeles Fair Chance Initiative For Hiring Ordinance, where applicable.', '      ', '', '    '""",b'[]',b'https://www.linkedin.com/jobs/view/1115106609/?eBP=JOB_SEARCH_ORGANIC&refId=ce9a2ab6-e944-4b2e-8d13-1ce595073194&trk=d_flagship3_search_srp_jobs'
