Job Title,Company Name,Time,Applicants,Place,Job Description,Skill,Urlb'Data Scientist',b'MRI Global Hire',"b""['Posted Date', 'Posted 3 days ago', '\\n            ', '\\n              ', '\\n                      ']""","b""['Number of applicants', '48 applicants']""","b'Los Angeles, California, United States'","b""'', '      ', '        ', 'As a ', 'Data Scientist', ', you will work on building the next generation of technologies. If you are eager to put your algorithm to test in front of customers and iterate based what happens in the real world, then this is your ideal job. ', ' ', 'Responsibilities:', ' ', ' ', ' ', 'Gathering and analyzing data, identifying key prediction/classification problems, devising solutions and building prototypes. ', ' ', 'Formulating machine learning approaches while paying attention to business metrics, designing features from the rich data available from many sources, training, evaluating, and deploying models. ', ' ', 'Researching and implementing methodologies to measure the impact of the technologies. ', ' ', 'Initiating and proposing unique and promising modeling projects, developing new and innovative algorithms and technologies. ', ' ', 'Developing high-performance algorithms for precision targeting, testing and implementing these algorithms. ', ' ', 'Interacting with other teams to define interfaces and understanding and resolving dependencies. ', ' ', ' ', ' ', 'Basic Qualifications:', ' ', ' ', ' ', 'At least 3 years of experience with Data Analysis, Predictive Analytics, or Machine Learning ', ' ', 'Experience using database technologies (SQL, Oracle, MySQL, PostgresSQL) and working with large data sets ', ' ', 'Use and understanding of No-SQL database technologies (MongoDB, CouchDB, Redis) ', ' ', 'Skill in creating repeatable and automated processes ', ' ', 'Strong knowledge of and experience with reporting packages, databases (SQL), and programming (XML, scripting). ', ' ', 'Creating databases, data models and repeatable ETL processes ', ' ', 'Strong communication and data presentation skills; ability to communicate with data-driven stories ', ' ', 'Ability to quickly adapt to new technologies, tools and techniques ', ' ', 'Flexible and responsive; able to perform in a fast paced, dynamic work environment and meet aggressive deadlines ', ' ', 'Ability to work with technical and non-technical team members', '', '      ', '', '    '""","b""['Data Analysis', 'Machine Learning', 'SQL', 'Storytelling', 'Communication', 'Databases', 'MySQL', 'Algorithms', 'Testing', 'Training']""",b'https://www.linkedin.com/jobs/view/1141121964/?eBP=JOB_SEARCH_ORGANIC&refId=7ca7ea25-1bff-4497-b0f3-47962b6c04dc&trk=d_flagship3_search_srp_jobs'
b'Data Scientist',b'Herbalife',"b""['Posted Date', 'Posted 3 days ago', '\\n            ', '\\n              ', '\\n                      ']""","b""['Number of applicants', '37 applicants']""","b'Los Angeles, California'","b""'', '      ', '        ', 'COMPANY OVERVIEW:', ' ', ' ', '\\xa0', ' ', ' ', 'Herbalife is a global nutrition company that has helped people pursue a healthy, active life since 1980. Our nutrition, weight-management and personal care products are available exclusively through dedicated independent Members in more than 90 countries. Our Mission is to change people\xe2\x80\x99s lives by providing the best business opportunity in direct selling and the best nutrition and weight-management products in the world. ', ' ', '\\xa0', ' ', ' ', 'POSITION SUMMARY STATEMENT:', ' ', ' ', '\\xa0', ' ', ' ', 'We are looking for a Data Scientist who will support our digital marketing team with insights gained from analyzing company data. The ideal candidate is adept at using large data sets to find opportunities for product and process optimization and using models to test the effectiveness of different courses of action. They must have strong experience using a variety of data mining/data analysis methods, using a variety of data tools, building and implementing models, using/creating algorithms and creating/running simulations. They must have a proven ability to drive business results with their data-based insights. They must be comfortable working with a wide range of stakeholders and functional teams. The right candidate will have a passion for discovering solutions hidden in large data sets and working with stakeholders to improve business outcomes. ', ' ', '\\xa0', ' ', ' ', 'DETAILED RESPONSIBILITIES/DUTIES:', ' ', ' ', '\\xa0', ' ', ' ', ' ', 'Work with stakeholders to identify opportunities for leveraging company data to drive digital marketing business solutions. ', ' ', 'Mine and analyze data from multiple data sources using appropriate techniques to drive optimization and improvement of digital marketing business strategies. ', ' ', 'Assess the effectiveness and accuracy of new data sources and data gathering techniques. ', ' ', 'Coordinate with different functional teams to develop custom models and algorithms. ', ' ', 'Use predictive modeling to increase and optimize customer experiences, revenue generation and other business outcomes. ', ' ', 'Develop processes to monitor and analyze model performance and data accuracy. ', ' ', 'Develop artificial intelligence stories using Salesforce AI toolset. ', ' ', 'Present data findings to senior management. ', ' ', 'Support day to day data requests as required. ', '', 'REQUIRED QUALIFICATIONS:', ' ', ' ', '\\xa0', ' ', ' ', 'Skills:', ' ', ' ', '', ' ', ' ', ' ', 'Strong analytical skills with the ability to collect, organize, analyze, and disseminate significant amounts of information with attention to detail and accuracy. ', ' ', 'Knowledge and experience in statistical and data mining techniques: Classification Analysis, Cluster Analysis, Regression Analysis, Anomaly Detection, etc. ', ' ', 'Experience querying databases and using statistical tools: SQL, Python, R, etc. ', ' ', 'Advanced skills in MS Excel and PowerPoint. ', ' ', 'Experience presenting business driving insights to stakeholders. ', ' ', 'Familiarity with digital marketing principles and data. ', ' ', 'Excellent communication skills, both oral and written. ', ' ', 'Strong interpersonal skills to build effective business relationships ', ' ', 'Experience:', ' ', ' ', ' ', '\\xa04-6 years\xe2\x80\x99 demonstrated experience with data processing, database programming and data analytics ', ' ', '1 \xe2\x80\x93 2 years\xe2\x80\x99 experience with digital marketing principles and data. ', ' ', 'Education:', ' ', ' ', '', ' ', ' ', ' ', 'Bachelor\xe2\x80\x99s degree in Mathematics, Computer Science or related field ', ' ', 'PREFERRED QUALIFICATIONS:', ' ', ' ', '\\xa0', ' ', ' ', ' ', 'Master\xe2\x80\x99s degree in Mathematics, Computer Science or related field. ', ' ', 'Experience with Salesforce platform, including Salesforce AI. ', ' ', 'Experience with Adobe Analytics Toolset. ', ' ', 'Experience with Microstrategy. ', ' ', 'Understanding of web analytics concepts and principles.', '', '      ', '', '    '""","b'[\'Python (Programming Language)\', \'Analytical Skills\', \'SQL\', \'Large-scale Data Analysis\', \'Salesforce.com\', \'Statistical Modeling\', \'Communication\', \'Business Strategy\', \'MicroStrategy\', \'Big Data Analytics\', ""Bachelor\'s Degree""]'",b'https://www.linkedin.com/jobs/view/1141921421/?eBP=JOB_SEARCH_ORGANIC&refId=7ca7ea25-1bff-4497-b0f3-47962b6c04dc&trk=d_flagship3_search_srp_jobs'
b'Data Scientist - Burbank',b'VySystems',b'',b'',"b'Burbank, CA, US'","b""'', '      ', '        Structured processoriented Proactively creating repeatable processes where possible Data manipulation SQL queries some Tableau nice aws Redshift and S3 knowledge - provided by Dice Data Scientist', '      ', '', '    '""",b'[]',b'https://www.linkedin.com/jobs/view/1129771144/?eBP=NotAvailableFromVoyagerAPI&refId=7ca7ea25-1bff-4497-b0f3-47962b6c04dc&trk=d_flagship3_search_srp_jobs'
b'Data Science & Artificial Intelligence Associate Department Director',b'The Aerospace Corporation',b'',b'',b'',"b'\'\', \'      \', \'        \', \'Requisition ID: 44797\', \'\', \'\', \'All Locations:\', \' El Segundo, CA (California)\', \'\', ""A trusted partner. A national resource. A leader in national security space. We are THE Aerospace Corporation. A team that takes pride in our readiness to solve some of the most complex technical challenges in existence. With challenges spanning government to commercial, you\xe2\x80\x99ll have the unique opportunity to work on projects that are literally evolving our nation\'s space and launch capabilities. We all share a common passion and aspiration \xe2\x80\x93 to serve a mission much bigger than ourselves. When you join our team, you\xe2\x80\x99ll be part of a rare collection of thought leaders and game-changing innovators. Are you ready to launch your career?"", \'\', \'\', \'Responsibilities\', \'\', \'\', \'The Data Science and Artificial Intelligence Department seeks an Associate Director to lead a diverse team of engineers, data scientists, and programmers with a passion for machine and deep learning, data analytics, natural language processing, statistical analysis, and computer vision. We are a growing, innovative, and collaborative department that makes meaningful contributions to National Security Space (AF, NRO, etc.), and Civil and Commercial customers (NASA, MDA, DHS, etc.).\', \'\', \'The ideal candidate has demonstrated leadership, teamwork, initiative, with a track record of developing cutting-edge technologies and frameworks, and are comfortable balancing a variety of projects spanning internally funded research and development to direct customer support for mission-critical space systems. They also have deep expertise in one or more of the following disciplines: Data Science, Applied or Theoretical Machine Learning, Deep Neural Networks, Classification Systems, Clustering, Natural Language Processing, and Artificial intelligence.\', \'\', \'\', \'Key Functions\', \'\', \' \', \'Provide technical and managerial leadership to develop, maintain, and apply organizational expertise to the machine and deep learning challenges across the corporation\', \' \', \'Recruit, hire, mentor, and lead technology experts and developers to provide the corporation with cutting edge machine and deep learning applications and prototypes demonstrating the state-of-the-art in this domain\', \' \', ""Develop and maintain relationships with program offices in order to propose pathfinder projects to sustain the department\'s activities"", \' \', \'Assign resources, determine staffing needs, and coordinates activities and operations among subordinate units\', \' \', \'Communicate and coordinate activities with counterpart organizations, management, and customers\', \' \', \'Provide in depth technical review and direction of activities performed by the department\', \' \', \'Provide effective management of staff to include performance evaluations and personnel career growth\', \' \', \'\', \'\', \'Required\', \'\', \'\', \'Qualifications\', \'\', \' \', \'Master\xe2\x80\x99s degree or higher in Computer Science, Electrical Engineering, Mathematics, Statistics, or a related field \', \' \', \'Typically, twelve or more years of experience in an engineering discipline and strong knowledge of machine and deep learning\', \' \', \'The ability to obtain and maintain a TS/SCI security clearance, which is issued by the U.S. government. U.S. citizenship is required to obtain a security clearance\', \' \', \'Fluency in at least one programing language (C++, Java, or similar) and one scripting language (Python, Julia, or similar)\', \' \', \'Familiarity with a broad set of supervised and unsupervised ML-based solutions to complex problems in business, science, or engineering\', \' \', \'Experience with fast prototyping\', \' \', \'Previous management experience with highly technical staff\', \' \', \'Demonstrated initiative and excellent leadership skills, with proven ability to build and manage effective development teams\', \' \', \'Proven ability to establish and maintain effective interpersonal and working relationships with various levels of corporate staff, peers, management, program offices, customers, and contractors\', \' \', \'Demonstrated ability in oral and written communication skills\', \' \', \'\', \'\', \'Preferred\', \'\', \' \', \'Current and active Top Secret/SCI security clearance \', \' \', \'Strong programming skills utilizing Scikit-learn, OpenCV, Keras and/or Tensorflow libraries\', \' \', \'Experience with machine learning methods like random forests, logistic regression, neural networks, k-nearest neighbors, etc\xe2\x80\xa6\', \' \', \'Fluency in SQL, NoSQL and other big data querying languages\', \' \', \'Experience in collecting data from/exposing data to various data sources and services (API, XML, JSON, etc\xe2\x80\xa6)\', \' \', \'Familiarity with Amazon Web Services for data analytics\', \' \', \'Experience in implementing real-time machine learning and data mining algorithms in large scale environments\', \' \', \'Strong analytical and creative problem-solving skills\', \' \', \'Experience with big data frameworks (e.g. Hadoop, Spark, etc.)\', \' \', \'\', \'Transcript Requirement\', \'\', \'\', \'None\', \'\', \'\', \'Additional Requisition Details\', \'\', \'\', \'Clearance Requirement: \', \'TS/SSBI\', \'\', \'\', \'Access: \', \' SCI\', \'\', \'\', \'Polygraph: \', \' Counter Intelligence Polygraph\', \'\', \'\', \'Relocation Available: \', \' Yes\', \'\', \'\', \' Employment Type: \', \' Regular\', \'\', \'\', \' Work Schedule: \', \' Full Time\', \'\', \'\', \'Company Statement\', \'\', \'\', \'The Aerospace Corporation has provided independent technical and scientific research, development, and advisory services to national security space programs since 1960. We operate a federally funded research and development center (FFRDC) for the United States Air Force and the National Reconnaissance Office, and support all national security space programs. We also apply more than 50 years of experience with space systems to provide critical solutions to technologically complex systems in such areas as communications, shipping, law enforcement, and cyber, among others.\', \'\', \'From our inception, our highly skilled technical staff has focused on ensuring the success of every mission and developing the most effective and economic space-related hardware and software in the world. Our greatest asset is the technical expertise of our people. Our state-of-the-art laboratory facilities are staffed by some of the leading scientists in the world.\', \'\', \'\', \'All Aerospace employees working in organizations with technical responsibilities are required to apply for and maintain at least a Secret clearance. U.S. citizenship is required for those positions.\', \'\', \'\', \'Equal Opportunity Commitment\', \'\', \'\', \'The Aerospace Corporation is an Equal Opportunity/Affirmative Action employer. We believe that a diverse workforce creates an environment in which unique ideas are developed and differing perspectives are valued, producing superior customer solutions. All qualified applicants will receive consideration for employment and will not be discriminated against on the basis of race, age, sex (including pregnancy, childbirth, and related medical conditions), sexual orientation, gender, gender identity or expression, color, religion, genetic information, marital status, ancestry, national origin, protected veteran status, physical disability, medical condition, mental disability, or disability status and any other characteristic protected by state or federal law. If you\xe2\x80\x99re an individual with a disability or a disabled veteran who needs assistance using our online job search and application tools or need reasonable accommodation to complete the job application process, please contact us by phone at 310.336.5432 or by email at\', \'      \', \'\', \'    \''",b'[]',b'https://www.linkedin.com/jobs/view/1119242803/?eBP=NotAvailableFromVoyagerAPI&refId=7ca7ea25-1bff-4497-b0f3-47962b6c04dc&trk=d_flagship3_search_srp_jobs'
b'Data Scientist needed for Data Science Software Company in West LA (120K-140K DOE)',b'Career Movement',"b""['Posted Date', 'Posted 1 week ago', '\\n            ', '\\n              ', '\\n              ', '\\n          ']""","b""['Number of applicants', '\\n                Be among the first 25 applicants\\n              ']""","b'Culver City, CA, US'","b'\'\', \'      \', ""        Our client provides solutions for media businesses to create, publish, and monetize content to reach a modern consumer base quickly abandoning traditional methods of consumption. Trusted by the world\'s largest media brands, social platforms, and leading Fortune 500 companies, their technology powers the most demanding and highest-profile consumer and audience participation initiatives, with record-breaking results. Based in Los Angeles, with offices around the globe, they work with companies such as The Voice/NBC, Facebook, CNN, American Idol/FOX, Sprint, Miss Universe, NBA, Sprite, NASCAR and more."", \'\', \'\', \'Responsibilities\', \'\', \' Generate data-driven insights to help guide client decision-making. Discover novel applications of data within entertainment. Work on a small team and take ownership of high impact projects. \', \' Work in a fast-paced environment with continuous deployment and rapid product iteration. \', \' Meet and work directly with media and entertainment clients to understand their needs and translate into product solutions. \', \' Understand how the futures of media, entertainment and advertising are being defined by the innovative applications of technology and data. \', \'\', \'\', \'Requirements\', \'\', \'1 \xe2\x80\x93 2 years of professional experience as a Data Scientist or Data Analyst. \', \' Experience with R or Python and comfort with databases. \', \' Master\xe2\x80\x99s degree or higher in Math, Applied Math or Stats. \', \' Self-driven individuals who take ownership of their work. \', \' Ability to build products quickly and efficiently. \', \' Strong understanding of data science practices and principles. \', \'\', \'Salary\', \'\', \'120K \xe2\x80\x93 140K \', \'\', \'Benefits/Perks\', \'\', \' Early-stage equity \', \' Health Coverage (100% employee cost covered Medical, Dental and Vision with partial cost coverage options for family) \', \' Free meals while working in the office \', \' Movie passes, fitness membership stipend, commuter subsidies, Apple hardware \', \'401K \', \' Flexible Personal Time Off (2 \xe2\x80\x93 3 weeks/year) and Paid National Holidays \', \' Flexible work hours (can start between 7a \xe2\x80\x93 10a but must stick to a schedule) \', \'\', \' No remote, visa sponsorship or transfers\', \'\', \'      \', \'\', \'    \''",b'[]',b'https://www.linkedin.com/jobs/view/1131818435/?eBP=NotAvailableFromVoyagerAPI&refId=7ca7ea25-1bff-4497-b0f3-47962b6c04dc&trk=d_flagship3_search_srp_jobs'
b'Data Scientist H/F',b'Groupe Macsf',"b""['Posted Date', 'Posted 3 days ago', '\\n            ', '\\n              ', '\\n              ', '\\n          ']""","b""['Number of applicants', '\\n                Be among the first 25 applicants\\n              ']""","b'Los Angeles, CA, US'","b'\'\', \'      \', ""        La MACSF est l\'assureur mutualiste n\xc2\xb01 des professionnels de sant\xc3\xa9. Elle propose une gamme compl\xc3\xa8te de services et d\'assurances \xc3\xa0 ses 950 000 clients-soci\xc3\xa9taire, pour les risques priv\xc3\xa9s comme pour les risques professionnels. En rejoignant la MACSF, vous mettez vos comp\xc3\xa9tences et votre \xc3\xa9nergie positive au service de tous les professionnels de sant\xc3\xa9, afin de les accompagner au quotidien. En rejoignant la MACSF, vous entrez dans une entreprise qui conjugue digital et humain. En rejoignant la MACSF, vous prenez soin de vos talents ! D\xc3\xa9sireuse d\'optimiser en permanence son efficacit\xc3\xa9 commerciale, la MACSF recherche aujourd\'hui un/une Data Scientist. Au sein d\'une \xc3\xa9quipe de cinq personnes rattach\xc3\xa9es \xc3\xa0 la Direction Marketing et Digital, vous aurez pour missions la mise en oeuvre - De reportings efficaces et pertinents donnant la visibilit\xc3\xa9 requise par les commerciaux et marketeurs : cartographie, datavisualisation. - D\'\xc3\xa9tudes de parcours, de machine learning et de scoring automatique visant au ciblage des actions commerciales."", \'\', ""Votre formation de type Master en Aide \xc3\xa0 la d\xc3\xa9cision, Etudes statistiques ou Data science, et au moins 3 ann\xc3\xa9es d\'exp\xc3\xa9rience dans ce domaine r\xc3\xa9pondront id\xc3\xa9alement au profil recherch\xc3\xa9. Votre capacit\xc3\xa9 \xc3\xa0 travailler en mode projet et collaboratif, votre go\xc3\xbbt pour le d\xc3\xa9veloppement informatique et votre adaptabilit\xc3\xa9 dans un univers en forte \xc3\xa9volution technologique seront les qualit\xc3\xa9s indispensables \xc3\xa0 la prise en main du poste."", \'      \', \'\', \'    \''",b'[]',b'https://www.linkedin.com/jobs/view/1141815784/?eBP=NotAvailableFromVoyagerAPI&refId=7ca7ea25-1bff-4497-b0f3-47962b6c04dc&trk=d_flagship3_search_srp_jobs'
b'Enterprise Data Scientist I',b'Farmer Insurance Group Co',b'',b'',"b'Woodland Hills, CA, US'","b'\'\', \'      \', \'        Enterprise Data Scientist I\', \'\', \'\', \'OA\', \'\', \'\', ""We are Farmers! Join a team of diverse professionals at Farmers to acquire skills on the job and apply your learned knowledge to future roles at Farmers. Farmers Insurance also offers extensive training opportunities through the award winning University of Farmers named by Training magazine amongst top 10 corporate training units in the world. Start your career at Farmers today! Job Summary The Enterprise Data Scientist I will be a valuable part of the Data Science team who provide statistical analysis, modeling, and vis ualization services for all lines of business and all shared service functions at Farmers Insurance Group. The Data Scientist 1 will work on end to end solutions as part of a team. They will design innovative analytic models and will be responsible for pulling and cleaning datasets, evaluating models, and presenting results to internal teams. Essential Job Functions Extract data from a variety of sources (databases, web, text files) and in a variety of formats (structured, unstructured, JSON, Parquet, etc.) and prepare the data for analysis Describe data using qualitative and quantitative aggregation/summarization and build tools (static reports, interactive dashboards, web applications) that allow clients to easily view and understand important patterns and trends in the data Provide quantitative comparisons of data points using advanced statistical analysis including data reduction techniques (PCA, cluste ring), resampling (permutation tests, Monte Carlo testing) as well as traditional statistical hypothesis testing Construct and validate predictive models using a variety of techniques Physical Actions Physical Environment Education Requirements Master\'s degree in scientific or quantitative field and documented academic excellence. PhD in scientific field preferred Experience Requirements At least year in a data analytics role (business intelligence analyst, data analyst, etc.) Special Skill Requirement Proficiency in at least one of the following is absolutely required: R, Python Basic proficiency in at least one of the following: PowerBI, Tableau, QlikView, D3.js Basic proficiency in SQL Able to implement and utilize advanced statistical and machine learning techniques (GLMs, PCA, cluster analyses, ARIMA, ETS, decision trees, SVM, neural networks, ensemble methods, etc.) Basic familiarity with project management tools (Asana, Basecamp, LiquidPlanner) Farmers is an equal opportunity employer, committed to the strength of a diverse workforce."", \'\', \'United States-California-Woodland Hills\', \'\', \'Farmers Insurance\', \'\', \'Strategic Management & Administration\', \'\', \'Full-time\', \'\', \'02/05/19\', \'      \', \'\', \'    \''",b'[]',b'https://www.linkedin.com/jobs/view/1125962738/?eBP=NotAvailableFromVoyagerAPI&refId=7ca7ea25-1bff-4497-b0f3-47962b6c04dc&trk=d_flagship3_search_srp_jobs'
